{
  "allocation_id": "company-personalization-example",
  "max_jobs": 1,
  "max_model_calls": 1,
  "max_input_tokens": 24000,
  "max_output_tokens": 2048,
  "max_total_tokens": 60000,
  "max_steps": 12,
  "cost_reservation_rub": 0,
  "cost_reservation_usd": 0.01,
  "cooldown_seconds": 3600,
  "max_jobs_per_company_per_day": 2
}
