{
  "allocation_id": "symfony-example-allocation",
  "max_jobs": 2,
  "max_model_calls": 1,
  "max_input_tokens": 24000,
  "max_output_tokens": 2048,
  "max_total_tokens": 60000,
  "max_steps": 12,
  "cost_reservation_rub": 1.0,
  "cost_reservation_usd": 0.0,
  "cooldown_seconds": 3600,
  "max_jobs_per_company_per_day": 2
}
